{"schema_version":"1.0","kind":"memory_unit","id":"replace-with-stable-id","title":"","summary":"","content":"","status":"canonical","scope":"project","importance":3,"confidence":0.8,"tags":[],"relationships":[],"sources":["source-id"],"created_at":"2026-09-06T00:00:00Z","updated_at":"2026-09-06T00:00:00Z","verified_at":"2026-09-06T00:00:00Z","verified_by":"Context Engineer"}

