{
  "schema_version": "1.0",
  "kind": "memory_unit",
  "id": "app1-unfrozen-teacher-dependencies",
  "title": "App1 unfrozen items awaiting teacher feedback (draft-only, never promote to fact)",
  "summary": "10 项内容依赖教师反馈、只能做草案不得冻结：Scene Pack 优先级、高频 Topic、Topic 教师语言、Topic-specific Evidence Policy、Follow-up 入口、首页近期关注、Watchlist 规模、正向 Evidence 交互、Validation 话术、ICP 收窄。",
  "content": "方案 v1.0 §9 明确：以下内容现在可做草案但不能视为定稿（未获新证据前不得升级为事实或写死进代码/记忆）：1. Scene Pack 最终优先级；2. 每个 Scene 的高频 Topic；3. Topic 的教师语言；4. Topic-specific Evidence Policy；5. Follow-up 最自然的场景入口；6. 首页是否展示“近期关注”；7. Watchlist 默认规模与排序；8. 正向 Evidence 的交互方式；9. 家长沟通 Validation Gate 的具体话术；10. 班主任兼语文 vs 纯科任的首版 ICP 收窄程度。依赖链：教师问卷 T11→T12 编码→T13 Scene 优先级→T14 Topic v1→T15 Evidence Policy v1→T16 Follow-up Context v1→T17 最终低保真原型→T26 最终 Scene Rules→T27–T30 可运行 MVP（均“是”等待问卷）。问卷未回时可推进（不冻结）：T08 本地数据安全边界、T09 IA 骨架、T10 三个 Scene Pack v0 草案（听写/字词、课堂观察、习作——仅压测用）、T18 狗粮指标。T20（目标 API Level/设备兼容范围）推迟到工程实现启动前，不阻塞 Domain 设计。工程含义：未冻结期间所有 Scene/Topic/Policy/呈现必须保持配置化或走 Adapter，任何实现不得把教师领域内容硬编码；首页“近期关注”静默区为待 UX 验证项，非定稿。Round 2 VOC 已把自动 Follow-up 提醒收紧为默认关闭、仅 opt-in 实验（见 app1-voc-evidence-status），任何把“今天待跟进”做成默认推送首页的方案违反基线。",
  "status": "canonical",
  "scope": "project",
  "importance": 5,
  "confidence": 1.0,
  "tags": ["app1", "unfrozen", "teacher-feedback", "draft-only", "guardrail"],
  "relationships": [
    {"type": "related_to", "target_id": "app1-frozen-baseline-t01-t02a", "note": "冻结/未冻结互补边界"},
    {"type": "related_to", "target_id": "app1-voc-evidence-status", "note": "Follow-up 呈现与首页信息受 Round 2 收紧约束"}
  ],
  "sources": ["app1-mvp-plan-v1-0"],
  "created_at": "2026-09-06T16:51:00Z",
  "updated_at": "2026-09-06T16:51:00Z",
  "verified_at": "2026-09-06T16:51:00Z",
  "verified_by": "Context Engineer"
}
